unique_id,article_title,article_type,publication_date,publication_text
LTN19791031-01.2.47,Hero's welcome greets old favorite,ARTICLE,31 October 1979,"<p dir=""auto"">Hero's welcome greets old favorite</p><p dir=""auto"">By Anne Graham An old hero returned to campus. A chubby brown nut called Brutus Buckeye with rabbit fur eyebrows and no hat was ""reborn"" for the homecoming parade, said Block ""O"" equipment manager Mark Wellman, a sophomore from Delphos. People along the parade route on High Street near the bandstand flocked around to have photographs taken with the copy of the original Brutus, said Brian Coady, a senior from</p><p dir=""auto"">Columbus and one of two people inside the newly built frame. The original Brutus, who was kidnapped several limes, painted maize and blue once and replaced twice by the Athletic Department, disappeared last year, Wellman said. The block designed the copy from photographs of the original that was retired by the Athletic Department autumn quarter 1977. Coady said the original ""disappeared"" sometime last year and he said mem-</p><p dir=""auto"">bers suspect Brutus was destroyed. The Athletic Department would not give Block ""O 'permission to bring the copy of the old nut into the stadium Saturday, ""because only one Brutus is allowed on the field at one time,"" a spokesperson for the department said. Block ""O"" officers stressed that their ""hero"" is not meant to compete with the department's new buckeye. The Athletic Department first tried to retire the original Brutus, which was created from fiberglass in</p><p dir=""auto"">1965.The replacement was a distorted mask, which, according to tfie Block ""O"" scrapbook, looked quite similar to the Purdue Boilermaker mascot. The original Brutus sneaked into the stadium after the replacement had been mascot at two games. When the original bounced onto the field, he received a standing ovation and the replacement ""disappeared"" Coady said. The present OSU football mascot is owned by the Athletic Department, Wellman said. The mascot works with the cheerleaders, not with the block, he added.</p><p dir=""auto"">The Athletic Department retired the original Brutus because of problems in his design, department spokesperson said in 1975. The department was seeking a replacement which was smaller, lighter and more manageable, Wellman said. The present mascot has holes in its hat forclearvision and the original Brutus ""had no eyes,"" he said. ""The original Brutus was larger and was not designed to be taken apart for easier traveling,"" Wellman</p><p dir=""auto"">said. Although many people feel that the original could have been repaired instead of creating a new mascot, Wellman said that the block and the Athletic Department don't want to create any more ""controversy"" about the situation. An OSU senior said she believes that the department ""killed another tradition at OSU,"" and that the original may have been a ""klutz, but at least he had personality.""</p>"
LTN19711019-01.2.53,Queen candidates vie ,ARTICLE,19 October 1971,"<p dir=""auto"">Queen candidates vie</p><p dir=""auto"">Queen for a day returns to Columbus this weekend when the 1971 Homecoming Queen is announced prior to Saturday ' s football game . Voting for the candidates will take place Wednesday , October 20 , between 8 a . m . and 6 p . m . There are a number of voting locations on campus . North Campus may vote in Royer , Raney and North Commons ; South Campus includes Women ' s , Bradford , and Baker Commons ; West Campus will vote at Lincoln and Morrill Tower . Ballots may also be cast at the Ohio Union , on the Oval , at 15 th and High and in Rightmire Hall . Photo ID's are required . Students may chose from 10 finalists ( five from on campus and five from off campus ) . The top five will appear as a court in the parade Friday night . Candidates are Ruth Bope , 19 , a sophomore from Somerset majoring . in nursing : Denise Darling , 19 , a sophomore from Mansfield majoring in home</p><p dir=""auto"">economics ; Jill Eversole , 19 , a sophomore from Baltimore , 0 ., majoring in textiles and clothing ; Karen Firestone , 17 , a freshman from Tallmadge majoring in speech and hearing therapy ; and Sandy Kollar , 19 , a sophomore from Masury majoring in music . Also running are Kathy Koscak , 20 , a junior from Parma majoring in English ; Pat Nelson , 18 , a sophomore from Cuyahoga Falls majoring in social work ; Libbie Pfefferle , 20 , a junior from Columbus majoring in fine arts and education ; Faye Ramirez , 20 , a senior from Bucyrus majoring in public recreation ; and Rosie Zouhary , 21 , a senior from Toledo majoring in dental hygiene education .</p><p dir=""auto"">Jill Eversole</p><p dir=""auto"">Kathy Koscak</p><p dir=""auto"">Faye Ramirez</p><p dir=""auto"">Karen Firestone</p><p dir=""auto"">Pat Nelson</p><p dir=""auto"">Ruth Bope</p><p dir=""auto"">Denise Darling</p><p dir=""auto"">Sandy Kollar</p><p dir=""auto"">Libbie Pfefferle</p><p dir=""auto"">Rosie Zouhary</p>"
LTN19711020-01.2.3,Jews harass Kosygin in Ottawa ,ARTICLE,20 October 1971,"<p dir=""auto"">Jews harass Kosygin in Ottawa</p><p dir=""auto"">Soviet-Canadian talks continue</p><p dir=""auto"">OTTAWA ( AP ) — Thousands of Jews poured into this capital Tuesday in a continuing campaign to embarrass Soviet Premier Alexei N . Kosygin . Police cordoned off the vicinity of the Soviet Embassy in preparation for the arrival of at least 110 busloads of protesters from other cities . Police</p><p dir=""auto"">UPI photo CANADIAN PRIME Minister Pierre Trudeau motions security men away as Soviet Premier Alexei Kosygin , in topcoat , leaves Parliament Hill after a</p><p dir=""auto"">2 '/ i-hour meeting with members of Parliament . Security was tight everywhere after a demonstrator jumped on Kosygin Monday .</p><p dir=""auto"">intended to keep protesters five blocks from the embassy in every direction . While authorities were preparing for an organized parade protesting alleged mistreatment of Soviet Jews , Kosygin was having another round of what were described as solidly businesslike discussions with Prime</p><p dir=""auto"">Minister Pierre Elliott Trudeau and other Canadian leaders . On the public front , the only Canadians who seemed to take notice of the visit were those with protests to make and axes to grind , and they have created a nightmare for both Soviet and Canadian authorities . The protests may dog the trip in</p><p dir=""auto"">other cities . Busloads of protesters already have been heading toward Montreal , where Kosygin is due Thursday for an overnight stay , and other demonstrations are promised for Edmonton , Vancouver and Toronto . A ram ' s horn signaled the beginning of the Ottawa march . The protesters formed up behind a group of rabbis and started toward a semicircle of several hundred police . Young parade marshals formed a barrier in front of the police to insure no contact with the protesters . A sprinkling of young men carried blue and white flags bearing a clenched fist inside a star — the insignia of the militant , New York-based Jewish Defense League . Rabbi Meir Kahane , leader of the league , and six companions were turned back to New Yrok after arriving in Montreal . Men with megaphones led chants — ""Let our people go , "" and ""Free Soviet Jewry . "" But the crowd was</p><p dir=""auto"">more picnic than protet in atmosphere , dispite the chant and the placards . The atmosphere was friendly . Security was far tighter Tuesday because of the attempt by a young man to assault Kosygin the day before . Geza Matrai , the 27-year-old Hungarian accused of assaulting Kosygin on Monday , it being held in custody until his case comes up in court next week . Kosygin ' s continuing talks with Canadian leaders again focused on international affairs and included a long exchange of views on the Middle East . Both nations support the United Nations' 1967 resolution calling for Israel ' s withdrawal from occupied Arab territories . Spokesmen said there was no discussion of either Vietnam or Red China , nor did either side mention the current Canadian grievances against the United States because of Washington ' s economic policies .</p><p dir=""auto"">STEADY THEREI Skating on the Oval for United Appeal is homecoming queen candidate Jill Eversole , 19 , a sophomore from Baltimore , Ohio . The drive , sponsored by the Ohio Staters , will continue through Friday .</p>"
LTN19740521-01.2.20,Collegiennes add kick to Kings Island ,ARTICLE,21 May 1974,"<p dir=""auto"">Collegiennes add kick to Kings Island</p><p dir=""auto"">By James Sahli The Ohio State University Collegiennes , a campus dance and drill team , will perform at the opening of Kings Island Amusement Park May 25 , said Marilyn Rice , the team ' s director and choreographer . The Ohio State military band will accompany the drill team at the opening . The Collegiennes , organized in 1972 , also performed at the Xenia benefit football game and the regular spring football game . The 25-member team has performed at Ohio State basketball games in the past . Bat-girls busy A few members of the drill team acted as batgirls for the baseball team this season . The baseball coach hopes to have the girls back next year , Rice said . The drill team had asked to perform with the Ohio State Marching Band the fall of its first season , but was not asked to perform with the band after a vote was taken of band members , according to David Griner , assistant director of University recreation and intramural sports and the team ' s faculty adviser . The Collegiennes will perform at the Homecoming parade this fall . Basketball games and other events still are tentative , Rice said . The team gets money for uniforms by supporting a summer workshop . The workshop will take place July 29-August 2 .</p><p dir=""auto"">Workshop gives instruction The workshop , which began in 1972 , offers high school girsl interested in drill team competition , a chance to come to Ohio State and participate in a week of drill instruction . More than 500 girls are expected this summer , Rice said . Rice said the drill team usually practices twice a week in the French Fieldhouse . For the spring benefit game , however , the team practiced almost everyday for a week at 6 a . m . in Ohio Stadium , she said . The Collegiennes sponsored a state competition March 31 in St . John Arena with 18 teams participating . Rice said assistance from parents has been a big part of the Collegiennes' success . The Collegiennes will be holding tryouts May 23 . A meeting for recruits is scheduled for May 22 .</p>"
LTN19751031-01.2.10,Drill team gets ' no ,ARTICLE,31 October 1975,"<p dir=""auto"">Drill team gets ' no</p><p dir=""auto"">Lantern Photo by Vicki Ogder The Ohio State Collegiennes , the 40-member all girls drill team , works hard during practice but its performances are never seen at half times of Saturday football games .</p><p dir=""auto"">By Jerry Rush The Ohio State Collegiennes , a 40-member all girl drill team , has everything it needs to become the best drill team in the Big Ten except a band to perform with . Marilyn Rice , director of the team , said she has tried ever since the group formed in 1971 to get permission for the team to perform with the Ohio State Marching Band during football halftimes . She said they have asked almost everyone from the vice president for student services down to the band director and always get turned down . SHE SAID there are many drill teams at universities across the country with six in the Big Ten . ""The University of Michigan just formed one this year . "" Rice said the teams can do several dance routines with shakers , flags and batons while the band is performing their own entertainment . Paul E . Droste , director of the Ohio State Marching Band , said , ""They have come to me several times asking to perform with the band but the answer is still the same ; no . ""</p><p dir=""auto"">Droste said , ""We are the best band anywhere and we just do not need them . "" THE DRILL team does get to march behind the band during the Homecoming parade and also does a routine during the halftime of two Ohio State basketball games a year . Droste said , ""I'll help them with those events but when it comes to the football halftimes , that ' s the band ' s show . "" He said , ""I don't think they could improve the band ' s performance . We can carry the show ourselves and have no need for any other group . "" Rice said , ""The band puts on a great halftime performance but I ' m certain the drill team could make it better . "" ""BESIDES , "" Rice added , "" we have a lot of talent this year . It ' s hard to find a better group anywhere . "" She said the team knows scores of high kicking dance routines . She said , ""The band director thinks I am just a trouble maker because I ' m always asking if the girls can perform . All I want is for the team to have a chance . ""</p>"
LTN19771017-01.2.40,Buckeyes bloom in Iowa's colors,ARTICLE+ILLUSTRATION,17 October 1977,"<p dir=""auto"">Buckeyes bloom in Iowa's colors</p><p dir=""auto"">By Jerry D. Shriver IOWA CITY, IOWA — Norman Rockwell couldn't have painted a more typical All-American setting for Ohio State's 27-6 win over the Iowa Hawkeyes. A colorful, crisp autumn afternoon in the heart of the cornbelt... homecoming.. .guys buying corsages for their gals (and hip flasks for themselves).. .pep rallies. ..bon fires., a parade. ..speeches by coaches and players extolling on the vi rtues of this Great American Game. It was all there. But for all its wonderland trappings, there were some elements surrounding the contest which can only be termed. ..unusual, from an Ohio State standpoint. For example, the Buckeye offense, lacking its characteristic sharpness, fumbled the ball five times, losing four, had several bungled plays and failed to score from the Iowa one-yard line on four consecutive, trys. Most unusual. Then, following the game, reporters were allowed' to roam at will through the Ohio State dressing room, free to worm deep secrets'from unprotected players. Highly unusual. Finally, when the members of the press had tracked down Woody Hayes in his dressing stall and began demanding an evaluation of his team's performance, the silver-haired figure sat there in his boxer shorts unconcerned, and answered in almost complacent terms. ""There is always some inconsistency,'' he said when asked about the fumbles, ""but we moved the ball. Four hundred and sixty-four yards, that's not too bad. We're getting better, beating people by comfortable margins."" When asked about the Iowa defense stopping fullback Joel Payton on four successive smashes from the one-yard line, the tough old general actually chuckled and said. ""Naw, I'm not perturbed. I think we can get it (the goal line offense) wound up again. We'll have to open some people up down there. We can pass down there — we don't like to but we can."" Speaking in more characteristic terms, Woody then returned to a favorite theme of his this year, the Buckeye defense, which he tc rmed ""just damn good."" His defenders intercepted ""three passes and held Hawkeye ballcarriers to only 69 yards rushing in another great performance. At the outset it appeared both defenses were trying to outdo each other as a 25-yard Ohio State field goal was the only scoring in the first quarter. As the second quarter opened, the Bucks used a 14-yard Gerald pass to Bill Jaco and runs by Ron Springs and Jeff Logan to move to the Iowa one where they had first and goal. Fullback Joel Payton. .the nation's leading scorer going into the game, rammed into the Hawkeye line four times but was stacked up each time. Payton, who had run the same play last week for four touchdowns said afterwards he felt he had scored. ""I may have been over on the second try, but I know I was over on the third."" The goal-line stand soon made little difference when the Bucks scored on their next possession. Gerald burst over left guard from the Iowa 44. embarrassed numerous would-be tacklers and sped to the end zone. Vlade Janakievski's extra point gave the Bucks a 10-0 lead. Janakievski scored again just before the half on a 28-yard field goal for a 13-0 halftime edge. In the third quarter, Ohio State had one drive stalled by a Payton fumble on the Iowa 21.</p><p dir=""auto"">S mm Lantern Photo by Dave Huey Quarterback Rod Gerald is about to be massacred by an Iowa defender in Saturday's conference clash in Iowa City.</p>"
LTN19781129-01.2.27,Reflection: OSU 10 years ago,ARTICLE+ILLUSTRATION,29 November 1978,"<p dir=""auto"">Reflection: OSU 10 years ago</p><p dir=""auto"">By Cathy Conlon Looking back a decade is amazingly like staring into a mirror — at first glance. Buckeye gridders were shooting for the Rose Bowl, OSU dorms and parking lots were overflowing and freshmen had discovered bar-hopping on High Street. Blazers and leather coats were ""in,"" marijuana was the no. 1 drug on 'college campuses and a cheerleader became homecoming queen. It was Autumn Quarter, 1968, at Ohio State, two and a half years before violent, student riots forced a two-week shutdown of Ohio State. Yet the campus lifestyle reflected in 10-year-old Lanterns bears a remarkable resemblance to today's complacent col-</p><p dir=""auto"">legiate existence. Naturally, there were some noticeable differences that dated the era. Front-page headlines were made when the Ohio Union began serving 3.2 beer and the cheerleaders donned skirts seven inches above the knee. The Women's Self-Government Association scored a victory by legalizing ""overnights"" in men's apartments for junior and senior women. Simon and Garfunkel were coming to St. John Arena, ""The Graduate"" was playing at the local cinema and McDonald's hamburgers rose in price from 18 to 20 cents. A local radio station featured ""the young sound"" of Petula Clark, Herman's Hermits. The Lettermen, The Association. Sonny &amp;</p><p dir=""auto"">Cher and Gary Puckett. Students were ""doing their own thing"" in Nehru jackets, culottes, mini skirts and midi coats. Linda Ronstadt and the Stone Poneys were appearing at the Bistro. 3246 Olentangy River Road.</p><p dir=""auto"">The Buckeye football team shut out powerhouse Purdue and fans danced in the streets until 3 a.m., marchingdown High Street to the Statehouse in the middle of the night with policemen leading the parade. It was fun to be young.</p><p dir=""auto"">watching Jackie and Ari tie the knot, Nixon, Humphrey and Pat Paulsen race to the finish for the presidency and LBJ halt the bombings of North Vietnam. Autumn Lantern editorials often dealt with nothing more than congratulate ing the football team an4 Woody on a ""real"" victory orcommendinga fraternity for its service project. But beneath the carefree campus atmosphere, a different kind of restlessness was beginning. A closer look at period Lanterns reveals the, rumbles of dis^A satisfaction coming closer . and closer to the Pepsi generation. Tucked in among reports of sorority rush parties, sports writeups and concert reviews were a photograph of rock-throwing</p><p dir=""auto"">youths in Chicago and stories on CatholicProtestant student riots in Ireland or leftist Japanese students picketing a U.S. , air force base in Tokyo, OSU President Novice Fa wcett himself gave a hint of things to come in his welcome address to 1968 freshmen. ""Ohio State is not an arena for political action, nor a fortress from which one may defy constitutional government,"" he warned. ""We will not wil-</p><p dir=""auto"">lingly serve as a soapbox upon which exhibitionists may pose in order to direct attention to their ludicrous and often revolting selfexpression."" That autumn, the university announced its policy on demonstrations, probably in response to several rallies which had been held the spring before. ""Peaceful demonstrations outside buildings are acceptable,"" Fawcett decreed, but he also said protests within campus build-</p><p dir=""auto"">ings would automatically be considered disruptive and participants would be subject to discipline. The same Lantern issue ran another article on the back page: ""Approximately 350 students, fac-</p><p dir=""auto"">ulty and outsiders gathered on the Oval Wednesday to hear the first protest rally of the season."" The Oval and the university were in for a longer season than any of the students could have dreamed.</p><p dir=""auto"">[a]</p><p dir=""auto"">Lantern File Photo The peace symbol — a sign of the late '60s — was a unifying emblem, signifying an awareness by students and a protest against national and international conflicts.</p><p dir=""auto"">Lantern Photo by Key Melts To the contrary, 1978 spring graduation strongly reflected the birth of the ""me"" generation and times in which the self took precedent over the group.</p>"
