unique_id,article_title,article_type,publication_date,publication_text
LTN19751017-01.2.61,Student spirit high : homecomings readied ,ARTICLE,17 October 1975,"<p dir=""auto"">Student spirit high : homecomings readied</p><p dir=""auto"">By Randy Pope The importance of homecoming varies among students but most notice an increase in spirit around campus during homecoming week . That opinion was expressed repeatedly by students interviewed by the Lantern earlier this week . This is the first homecoming at Ohio State for Peter Steve , a student in continuing education from Youngstown , and the atmosphere is very different from his alma mater , Bowling Green . ""HOMECOMING AT BG is dying , but there seems to be more rah-rah and participation here , "" Steve said . ""However , I ' m not involved because it still seems too much of an expected thing to do . "" Martha Caudill , a freshman from Franklin , said she is excited about her first college homecoming . A ""festive spirit"" prevails in Baker Hall and student participation is good , she said .</p><p dir=""auto"">Charles Lawler The homecoming tradition also appeals to Charles Lawler , a junior from Cleveland . He said he looks forward to marching in the parade of floats behind ROTC's first homecoming float . ""MOST OF the interest around the dorm concerns the homecoming concert and the social aspects , like partying , "" said Jann Felder , a senior from University Heights . ""Very few of the people I've talked to are interested in the float ac</p><p dir=""auto"">tivities . "" Students from the greek community said homecoming interest is great . Many fraternities and sororities will hold parties , dances , dinners and activities aimed at celebrating the return of alumni . THE RETURN of alumni makes this weekend really special , said Park Studebaker , a junior from Dayton . ""It provides a good opportunity for everyone to get together and for students to meet some of the older alumni , "" Studebaker said . Laura Morse , a Delta Zeta sophomore from Columbus and a Delta Zeta sorority member , said she enjoys the tradition of building a float . ""Once we began the float things really started buzzing and everyone got into the swing of things , "" she said . Float building is also a big part of the weekend festivities for Dennis Armstrong , a senior from Akron .</p><p dir=""auto"">Lantern Photos by Vicki ORden Jann Felder</p><p dir=""auto"">^ K n ^ HBBi ^ rftftft' S ^^ B ^ W ^ M *^ ^ z * JtwL ^ ^ KH VP ^^ -</p><p dir=""auto"">Peter Steve</p>"
LTN19701019-01.2.12,Time and change mark festivities ,ARTICLE,19 October 1970,"<p dir=""auto"">Time and change mark festivities</p><p dir=""auto"">By ANN SHELDON Lantern Staff Wriler The Age of Homecoming dawned this past weekend , and thousands of Ohio State and alumni were on hand for the festivities . The activities began with Friday night's traditional pep rally and bonfire on the east side of Ohio stadium . Led by the Ohio State Marching Band , cheering and singing students paraded around campus from 15 th and Iuka Avenues to Stadium carrying signs and shaking noise</p><p dir=""auto"">makers . Most spirited delegations Delta Gamma sorority , DavissonHanley Scholarship House , and Patterson and Smith Halls were judged to have the most spirited delegations in the rally march . At the stadium , more than 2 , 000 people gathered to watch the bonfire and listen to coach Woody Hayes introduce the team . Later that evening a more subdued crowed of about 700 danced under ""The Lights of Libra"" at the homecoming dance in the Ohio Union .</p><p dir=""auto"">Miss Jeanne Ramer , a sophomore from Piqua , was named 1971 Homecoming Queen . Wearing long formals and carrying long-stemmed red roses , Miss Ramer , her first alternate , Miss Chris Vogel , and her court , Misses Claudia Balliett , Cheryl O'Leary , and Connie Workman , were escorted to the stage of the ballroom at 10 p . m . There they were introduced and greeted by President Fawcett . . Saturday morning about 500 people were on High Street to watch the</p><p dir=""auto"">parade of homecoming floats . Dawning of Age theme In keeping with the theme ""Dawning of the Age , "" many floats depicted prehistoric man while other concentrated on man of the future . Other floats dealt with football and historic landmarks around campus . During the game the floats were parked around the oval . Homecoming activities drew to a close with the football game and the Dionne Warwick concert Saturday night .</p>"
LTN19711022-01.2.3,Queen finalists announced ,ARTICLE,22 October 1971,"<p dir=""auto"">Queen finalists announced</p><p dir=""auto"">Finalists for the 1971 Homecoming queen were trimmed from 10 contestants to five by a vote of students Wednesday . Finalists are : Jill Eversole , 19 , a sophomore from Baltimore , Ohio ; Sandy Kollar , 19 , a sophomore from Masury ; Kathy Koscak , 20 , a junior from Parma ; Pat Nelson , 18 , a sophomore from Cuyahoga Falls ; and Faye Ramirez , 20 , a senior from Bucyrus . ""Approximately 4 , 000 students voted in the election on Wednesday , "" said Pam Segrist , a senior from Swanton and Homecoming chairman . Eversole , who will be on the queen ' s court , cannot be queen . She was declared ineligible by the Student Event Board after a picture of her appeared on the front page of Wednesday ' s Lantern . The appearance of the picture violated a rule governing the queen contest which states that all candi</p><p dir=""auto"">dates must receive equal publicity . Sources close to Eversole said Thursday night no action is planned to contest the ruling and Homecoming queen election . Announcement of the queen and presentation of her court will be made during the pregame activities Saturday . Results of the Undergraduate Student Government referendum , placed on the same ballot as the Homecoming queen candidates , have not been establsihed . Activities for the weekend ' s Home</p><p dir=""auto"">coming events kick off today at 6 p . m . with a parade down High Street , followed by a bonfire and rally at the east of Ohio Stadium . ""Friday Night at the Movies"" in the Ohio Union will be a Homecoming feature at 8 : 15 p . m . today . Saturday ' s highlight will be the crowning of the Homecoming queen in pregame ceremonies before the Buckeyes meet the Wisconsin Badgers . Jethro Tull in concert in St . John Arena will conclude the festivities at 8 p . m . Saturday .</p><p dir=""auto"">David Huber photo BARB PEIFFER , senior from Piqua , reigns as the Phi Kappa Tau "" pumpkin princess"" until a successor is chosen Tuesday . Profits from the fraternity ' s</p><p dir=""auto"">annual pumpkin sale will go toward purchasing a seeing-eye dog for a blind Ohio State student .</p>"
LTN19711026-01.2.15,Homecoming 1971 was ... ,ARTICLE,26 October 1971,"<p dir=""auto"">Homecoming 1971 was ...</p><p dir=""auto"">... the new queen being crowned ... ByKathyZinser Pat Nelson , 18 , sophomore from Cuyahoga Falls majoring in social work , was crowned 1971 Homecoming queen during a ceremony prior to Saturday ' s football game with Wisconsin . Announcement of the queen and her court was made by Pam Segrist , a senior from Swanton and Homecoming Committee chairman . Members of the court are Jill Eversole , 19 . sophomore from Baltimore , Ohio ; Sandy Kollar , 19 , sophomore from Masury ; Kathy Koscak , 20 , junior from Parma ; and Faye Ramirez , 20 . senior from Bucyrus . Jeanne Ramer , last year ' s Homecoming queen , crowned Nelson who was escorted by Sandy Fain , senior from Lorain . Calling for a "" personal effort to bridge the generation gap , "" Richard M . Mall , director of Alumni Affairs for the Ohio State University Association , kissed the queen after presenting her with a trophy . Also present at the ceremony was Miss Universe , Georgina Rizk of Beirut , Lebanon .</p><p dir=""auto"">""I wasn ' t elected to represent the women of Ohio State , "" Nelson said . ""I ran to represent all of Ohio State . '' She will participate in various campus activities and will make presentations when called upon to do so , according to Nelson . Though many girls who become queens are under criticism from the women ' s liberation movement , Nelson believes her decision to run has not hurt the movement . ""There are some things I agree with , such as equal pay opportunities , but there are also other aspects that I disagree with , "" she said . Nelson said she didn't believe it was the man ' s place to stay at home while the wife works . Along with the bouquet and trophy , Nelson will receive a $ 100 scholarship and various prizes donated by campus merchants , according to Segrist .</p><p dir=""auto"">Jim MacQueen photo HOMECOMING QUEEN Pat Nelson ( above ) is crowned with a 150 carat tiara valued at $ 100 , 000 at pregame ceremonies Saturday . President Fawcett ( below ) looks on during last-minute preparations for Friday ' s Homecoming parade .</p>"
LTN19731017-01.2.26,No queen ,ARTICLE,17 October 1973,"<p dir=""auto"">No queen</p><p dir=""auto"">Ohio State ' s Homecoming Queen contest is a ridiculous , outmoded tradition that should be discontinued . At a school the size of this university , the majority of the students never have seen or heard of the members of the homecoming queen court and most could not care less who those selected beauties are . The Homecoming Committee should have taken a hint from the student body which year after year has refused to vote in any significant numbers for queen candidates . ""The response has been so bad we changed the voting so that a panel of judges picks the court now , "" Eldon Plummer . co-chairman of the 1973 Homecoming Committee , said . Changing the manner of selecting the court does not change the fact that the contest basically boils down to a cheap ego trip for a couple hundred contestants . At many small colleges , the contestants are known by practically all of the</p><p dir=""auto"">student body and the contest is anxiously awaited because of the meaning it has for students . But at a huge university such as Ohio State , the contestants are unknown and the contest has little if any meaning to the school . The contest itself has gone sexless , as males were allowed to enter last year for the first time . Two men did , but neither was fortunate enough to make the queen ' s court . If a male does win the coveted title he will still be hailed as "" queen . "" Colleges and universities across the nation have elected cows , pigs and males to point out that the practice of selecting one woman to reign over a day ' s festivities is really a laughing matter . The duties of the queen at the homecoming parade Oct . 27 are ""to be there and look nice , "" according to Plummer . What a thrill it must be to know that you were the one selected who could be there and look nice .</p><p dir=""auto"">' . 'The idea of homecoming is that it ' s a little of the 'Go , go Ohio State' bit , "" Plummer explained . ""It sort of rounds out homecoming to have a queen and court . "" If it ' s rounding out they want , let ' s make Brutus Buckeye queen !</p>"
LTN19751017-01.2.58,Homecoming : a nostalgic look back ,ARTICLE,17 October 1975,"<p dir=""auto"">Homecoming : a nostalgic look back</p><p dir=""auto"">14 THE OHJO STATE tANTERN , Fri ., Oct . 17 , 1975 j £ XCiteiUeUt Of UUSt UUfOT'gettable</p><p dir=""auto"">By Howard Moore Eds . Note : Howard Moore is working as a Lantern reporter as an enrollee in the University ' s Program ' 65 . Moore , a 1933 Ohio State graduate , has seen many homecomings and has gathered his impressions of activities then and now . Something about homecoming week in and around Buckeye Land gets into one ' s blood stream . Unforgettable , you mean ? Visualize October ' s golden leaves floating lazily down from high branches . Trees , like blazing fires , under blue , cloudless skies . Those chrysanthemums and marigolds along the Oval . Then laurel and old rose bushes . Then the Buckeye band , the floats and the homecoming parade . Finally , the climactic game</p><p dir=""auto"">— Badgers versus Bucks . This year it ' s difficult to gel a better setting for homecoming week . Besides , the Bucks are Number 1 and aiming to stay that way . And those fraternities and sorority houses and the people — they'll all be out trying out newer designs for floats or dragging out older versions for repair and newer ideas . Don't overlook "" nostalgia "" — a nameless something difficult to pinpoint . All the same , the ""thing"" is there . One gets the ""feel of homecoming"" with old grads coming back after long absences , the chatting of oldtimers , or maybe dropping by for open house at your favorite place . Maybe a visit with a house mother , someone you neglected to write .</p><p dir=""auto"">IT COULD be a person like ""Mom"" Hayes , house mother over at Alpha Zeta , agricultural fraternity house , 14 th and Indianola . Listening to this lady's experiences in and around Buckeye land is contagious . But the fellows , year in and yea "" r * out , come back for a chat with Mom Hayes . She will tell you a thing or two about the "" good Old days . "" For Mom Hayes it has been 26 years of service at five different fraternities . She was brought into Alpha Zeta just this year , but — the lady</p><p dir=""auto"">added herself — she wouldn't have changed any of it . At the point of leaving , Mom was the escort out to the front hallway to show a large silver plaque which had been given to her by the boys recently . The silver plaque with names in large letters for Mom was in recognition of 25 years of service and devotion to frat boys in her charge . She could be elected ""homecoming queen mother"" in any showdown of popularity . One gets the 'feel of homecoming' with old grads coming back</p><p dir=""auto"">About homecoming , Mom rambled on , ""The boys do anything I ask without question . They willingly divide up work among themselves , keep things organized . If the house needs anything , all I need to do is ask . "" Mom Hayes glowed when she retold how lads in one fraternity she served helped out in an unusual manner when Xenia ' s tornado struck . They had great spirit , she said , and are ambitious in anything they do . She spoke about old Ohio Field of the Chick Harley days and of the first homecoming crowds in the shadow of the newly built Ohio stadium in 1921 . OVER AT THE Phi Kappa</p><p dir=""auto"">Tau House , members were found preparing for the Annual Pumpkin Sale starting Oct . 16 . It is a goodwill venture with proceeds set aside for purchase of a dog for a needy blind lad . Each fraternity cooperates with a sorority with specific girls entered in the pumpkin queen contest . A promotion idea — anyone who buys a pumpkin becomes eligible to vote for a girl in this contest . As the Pi Betta Phi sorority on Indianola , girls are still talking about their success last year of getting four girls on homecoming court . They are still elated that any of at least three girls could have been elected queen last fall . Such success whets the ' 75 selection for queen . When the subject of floats for the ' 75 parade came up , a bystander noted there is ""less secretiveness"" in the planning and designs this year . Getting fellows started early enough to meet deadlines for completion is still a big problem , he said . At the Phi Delta Theta fraternity on luka , Don Huline is chairman of a homecoming committee . He believes that ""homecoming pranks"" are dying off . ""The fellows here and at other houses are terribly busy and actually more serious minded about their homecoming chores , "" Huline declared .</p><p dir=""auto"">IT IS A WEEK of great expectations over at Pi Beta Phi . Open house will be the main emphasis . They have a girl named for homecoming queen — Marilyn Doyle . They will have a big float using chrysanthemums , and while working with Beta Theta Pi on it , there may be bouquets to spare . Could you come up with some new idea about</p><p dir=""auto"">""elected queens ? "" Back in 1925 , a Buckeye homecoming committee hauled out one — most unusual to say the least . That year , during Farmer ' s Week , a champion cow , Maudine Ormsby , was elected queen . She beat out a court of 10 beautiful girls for that prize . The 1925 Makio carries the story and with it a picture of the select cow alongwith that of Ex-Governor Frank Lowden of Illinois who was visiting here . And on the next page , there is another picture of Maudine at the center of a cattle judging clinic . For 1929 the Mardi Gras parade was a principal highlight homecoming week . Thirty-six floats were entered , the whole being led by the queen and the strutting Ohio State band . That same day Queen Ethel Husselman took a little ride in the Goodyear blimp ""Defender "" ( blimps are bigger now ) and landed at Ohio Stadium shortly before the game . Speaking of old year books , maybe you've noticed how Makios have handled Back in 1925 , a champion cow was elected queen</p><p dir=""auto"">homecoming events over the last half-century . You'll find the older ones over at Main Library , second floor , along with other treasured legends and traditions of Ohio State University .</p><p dir=""auto"">THE MAKIO of 1932 , through the medium of photos , provides a panorama of Ohio ' s homecoming traditions . Interesting they are , though perhaps many have fallen in discard over the years . One picture in the 1932 Makio has well-known Bill North billed on the same page with the Ohio Champion relay team of the same year . But the stadium is the background and you see crowds arriving for the ""big game . "" You'll see a picture of Wesley Fesler stepping down from the rostrum — presumably under the stadium where a banquet had been held . In 1931 , 44 years ago this fall , a heavily favored , strong</p><p dir=""auto"">Wisconsin Badger team came to the stadium to play the Buckeyes . The homecoming game turned out to be a defensive fight all the way . Most of the game the Buckeyes outbattled the Badgers . Yet something was missing — that final drive that scores touchdowns . Today , old-timers will be able to recite names of those battlers — fellows like Bob Horn , Bill Bell , Lew Hinchman , Wesley Fesler , Marty Varner and many others . Late in the game Fesler was forced to leave the game because of an injury . You could see the Ail-American back and end limping to the bench , head hanging , tearfully , one of those climaxes about homecoming never to be forgotten . HOMECOMING PLANS I</p><p dir=""auto"">give the local alumni association plenty of opportunity to help plan and carry out homecoming activities . Plans are made for one evening and the following day and evening , supposedly Friday evening and Saturday afternoon and evening . Old folks : beware of taking long rides with lower classmen</p><p dir=""auto"">On Friday there may be an alumni banquet to which all alumnus — wives and husbands — are invited . The banquet location will have to be planned locally ; it may be in a church , a club , a hotel or just about anywhere . Tickets are usually sold a week in advance and at the time of sale , the purchaser and the date of his graduation should be registered . This warning is to seniors and old grads , old folks who</p><p dir=""auto"">were the original instigators of abductions for long rides , the Friday night pie fights , and other tomfoolery victimized on incoming Freshmen . Now the shoe is on the other foot . Beware of taking long rides with unknown lower classmen . You could wind up stranded at some desolate predecided place without benefit of any money . Besides , you might not be able to make it back in town for the ""Big Game"" come Satur</p><p dir=""auto"">day . One warning should be sufficient . IN DAYS GONE by ""Senior Rides"" were a tradition of Alpha Gamma Rho with seniors the usual victims of ""long rides . "" One ofthe rules of such rides was upper classmen were not allowed to be taken out of Ohio ; but since Kelly's Island was still part of Ohio , several of them found themselves stranded there . Getting back to home base added to the anxiety .</p>"
LTN19701117-01.2.9,Service group plans Michigan game rally ,ARTICLE,17 November 1970,"<p dir=""auto"">Service group plans Michigan game rally</p><p dir=""auto"">Alpha Phi Omega Service Fraternity will sponsor a rally for the Michigan game on the West terrace ot the Ohiio Union Friday at 7 p . m . Jack Marcinick , rally</p><p dir=""auto"">chairman , said the rally will be similar to the homecoming kick-off rally but there are no plans for a parade . Marcinick said the team , coaching staff , cheerleaders and band will be there . ""We also hope to have Mayor M . E . Sensenbrenner there since he is a big backer of the team . ""</p>"
LTN19751017-01.2.63,Homecomings big at schools ,ARTICLE,17 October 1975,"<p dir=""auto"">Homecomings big at schools</p><p dir=""auto"">By Jerry Rush While homecoming may not mean much to some Ohio State students , it is one ofthe biggest and most anticipated events ofthe year for some ofthe area ' s smaller universities . At Capital University , the festivities begin four days before the Oct . 18 homecoming . Tim Philabaul , homecoming chairman , said the week before homecoming is highlighted with square dancing , jazz bands and a huge outdoor barbecue for all the students . Students' spirits are further heightened , Philabaul said , by cancelling of classes the Friday afternoon before the game with a bonfire and pep rally later in the evening . Capital University will host Mount Union College for the game . Homecoming queens of the past 25 years will be featured at that time . THE FESTIVITIES will close with a semi-formal dance that night . Charles Renner , a junior from Dunkirk , said , ""There is definitely a lot of student enthusiasm at Capital , especially with the freshmen . "" Steve Tymer , a senior from Columbus , said , ""When people at Ohio State think of homecoming , they think football and not much else . But at Capital the football team is not the dominating part of homecoming . At Capital we put more emphasis on the homecoming ceremony and the greeting ofthe alumni . "" Dale Bauer , a junior from Buffalo , New York , said , ""My high school never really had a homecomingso to be a part of one now is really exciting . I also get a kick out of watching all the guys try to get a date for the</p><p dir=""auto"">uuiuci -uiiimg luuiuan game w mi musiMii giuu v ^ uiiege . ""WE ARE a suitcase college . "" said Ralph Carpellotti , director of the Otterbein Campus Center . He said , ""Almost all Otterbein students pack up and go home on the weekends , since there usually isn ' t much to do . But homecoming weekend is a time when hardly anyone goes home . "" • Otterbein ' s homecoming on Oct . 25 will be highlighted by a parade featuring 18 vehicles , 10 floats , eight marching bands and a riding corps of 20 women on horseback . The homecoming queen will be crowned during the halftime of Otterbein ' s game against Wooster College , Carpelloti added . A buffet dinner for the students and an informal dance will follow the game and end the celebration . Carpellotti added , ""The homecoming always generates a lot of student enthusiasm here . The students really think it ' s great . "" BOB BUCHAN , a senior from Columbus , thinks the size ofthe school is what makes the students get more involved in the homecoming . ""Since we are just a small school , everybody knows everybody else . Because of this everyone does all they can to make a good homecoming . Also , since everyone knows who the queen candidates are and see them almost every day , there are more people that vote for homecoming queen , "" he said . Beatrice Stephens , director of alumni affairs for Dennison University , said , ""The enthusiasm is just phenomenal . I ' ve never seen so much of it . "" Even though their campus women ' s liberation organizations have put an end to the ceremony of electing a homecoming queen , they are still expecting a large number of alumni to return to see the Oct . 25 homecoming football game with Muskingum College .</p>"
LTN19701120-01.2.18,"Woody , team , band to highlight game rally tonight at Ohio Union ",ARTICLE,20 November 1970,"<p dir=""auto"">Woody , team , band to highlight game rally tonight at Ohio Union</p><p dir=""auto"">Alpha Phi Omega Service Fraternity will sponsor a rally for the Michigan game on the west terrace of the Ohio Union today at 7 : 00 p . m . Jack Marcinick , rally chairman , said that the rally will be similar to the Homecoming kick-off rally , but there are no present plans for a parade . Marcinick said that the team , coaching staff , cheerleaders and band will be there . ""We also hope to have Mayor M . E . Sensenbrenner there since he is a big backer of the team , "" Marcinick said .</p>"
